,Какая «большая цель» Росатома может вдохновить Вас на работу и наполнить смыслом ваш ежедневный труд?
900,Создание высокоэффективных и дешевых низкотемпературных термоядерных источников энергии.
901,Цифровизация атомной отрасли
902,Снижение времени протекания процессов и снижение себестоиомсти
903,много денег... оооооочень много денег... дохреналиарды дохералионов
904,Стать мировым лидером в сфере атомной энергетики
905,Эффективность ежедневного труда и организованность процесса
906,увеличение доли неядерной продукции в портфеле заказов предприятия
907,Обеспечение обороноспособности и безопасности страны в целом
908,Работа по реализации нац проектов (Цифровизация). Работа на благо Родины.
909,Зарплата как у специалистов в атомной энергетике Европы!
910,"Новые продукты, ранее не представленные на мировом рынке. Передовые технологии в отрасли."
911,Понимание процесса выхода Росатома на первое место в России по обороту/прибыли/вклада в развитие страны
912,"Стать современной, лидирующей мировой компанией."
913,"Позиционирование РФ в мире, как технологического лидера в ОИАЭ. Обеспечение энергитической безопасности на национальном уровне."
914,"Выход Росатома из под государственного управления и глобализация мировой атомной энергетики под ""крылом"" Росатома"
915,"1) Возможно, та цель, в которой более явно будет заметно мое непосредственное участие (влияние); 2) Развитие направлений, необходимых в будущем, и не всегда связанных напрямую только с обогащением. Например, вывод из эксплуатации АЭС."
916,Сделать этот мир лучше. Наполнить мир чистой энергией на благо человества.
917,Стать катализатором развития электромобилей в РФ (строительство зарядных станций)
918,Каждый день работаем для лучшего будущего
919,Улучшение программ входящих в контур используемых. Упрощение рабочих моментов
920,Обеспечение максимальной безопасности АЭС.
921,"Проект, направленный на улучшение финансового состояния корпорации и сотрудников"
922,Безопасность и уважение со стороны руководства
923,Быть лидером цифровизации в стране.
924,"Трансформация из «атомной» Госкорпорации в критически важный базисный элемент (на основе имеющегося научного, технологического, производственного потенциала), задающий векторы дальнейшего развития государства."
925,"Для меня Главной ""большой целью"" Росатома, как мотиватора, является повышение уровня жизни граждан России посредством решения простых житейских проблем небогатой части населения, путем адресного перераспределения бюджетных средств, пополняемых за счет эффективной реализации бизнес-проектов Росатома в России и за рубежом"
926,Улучшение уровня жизни по всей стране.
927,Укрепление и расширение позиций Росатома на мировом рынке и в научной деятельности. Занять лидирующую ступень в развитии альтернативных источников энергии.
928,Инновации (участие в инновационных проектах) в направлениях деятельности Росатома связанных с разработкой и изготовлением оборудования для атомных энергетических установок
929,"1. Улучшение экологической ситуации в России и в мире. 2. Улучшение качества жизни населения России и мира с помощью производства электрической энергии, разработки и реализации доступных средств ядерной медицины и информационных технологий."
930,увеличения экспорта выпускаемой продукции
931,Развитие и внедрение передовых технологий для обеспечения обороноспособности и роста экономики России.
932,возможность лично раскулачивать коррупционеров
933,"Гибкая разработка и производство (полный цикл от идеи до продукта) новых продуктов для устойчивого развития общества в таких сферах как: экология, безопасность, эффективное использование энергоресурсов, здравоохранение."
934,Решение энергетической проблемы на базе делящегося атома.
935,запустить Белорусскую АЭС
936,"Оздоровление экономики, экологии, условий жизни. ЭКО-ориентированное устойчивое к манипуляциям общество. Эко-безопасное электричество для всей планеты. Инструмент влияния на поведение корпораций и стран уничтожающих планету. Доступные автономных поселений в любых условиях - технологии для дальних космических перелётов."
937,"По моему мнению, смыслом ежедневный труд наполняет интерес к работе и понимание того, что ты сделал сегодня - поможет завтра другим людям. Соответственно если твой труд не ценится или не направлен в правильное русло (линейным, в первую очередь, руководителем), то и ""Большая цель"" Росатома не поможет. А если пофантазировать: Колония на Марсе."
938,Усиление позиций РА на мировом рынке
939,Достижение положительного результата.
940,"Чувство сопричастности к решению хотя бы маленького кусочка Большой Задачи, а не мелкого винтика, которому Большие Дяди сказали ""Делай и помалкивай!"", но не сказали ""как"" и ""зачем"". А, иногда и ""что""..."
941,"создание новых продуктов, если они меняют к ""лучшему"" жизнь миллионов людей в нашей стране"
942,Повышение благосостояния работников отрасли.
943,"""Чистая"" и дешевая энергия для моих детей"
944,"замещение традиционной энергетики энергетикой , дружелюбной для окружающей среды"
945,Убрать статистов-нахлебников и лишнюю отчетность
946,Поддержание обороноспособности страны
947,Работа
948,я стал меркантильной ****( и возможно я стал слишком стар для этого ****(
949,"Лично у меня смысл есть. Мне нравится то, что я делаю. Я люблю свою работу. Признания от руководства бы хотелось( Поэтому в качестве ""большой цели"" пусть будет признание за ежедневный труд, а не только за большие заслуги (кладовщицы, секретари и т.д. и т.п.)"
950,Делать мир лучше)
951,Постоянное совершенствование и развитие своих навыков
952,Освоение новой продукции
953,"Разработка новых видов энергии, способов их получения и интеграция в повседневную жизнь. Правда, если буду там полезен..."
954,Цели давно уже поставлены и будут решаться вне зависимости от моего мнения и моего труда.
955,Быть первыми в мире.
956,Совместная встреча с руководством.
957,выход на международный уровень
958,работа в команде
959,вклад в обороноспособность страны
960,продвижение вперед
961,Общие интересы
962,Престиж страны.
963,Снижение себестоимости за счёт уменьшения накладных расходов
964,Увеличение влияния на мировом рынке.
965,Новые направления бизнеса
966,"Самореализация, денежное вознаграждение,саморазвитие."
967,"Хочу работать по своей специальности, если я буду знать что в конце концов стану аппарат иском, мытье полов будет иметь смысл."
968,Уменьшение себестоимости продукции и увеличение скорости протекания процессов
969,Достойная заработная плата.
970,Новые продукты для рынков
971,Защита нашей Родины.
972,Стать технологическим лидером России.
973,Работа в сыере медицины и соц. помощи.т
974,Увеличение доли на международном рынке
975,Сильнее Росатом - сильнее Россия
976,"""Развитие предприятий отрасли и городов где они находятся"""
977,Что мы все единая команда и работаем на благо всего Росатома и страны
978,Выход на новые рынки
979,Мир во всем Мире
980,Разнообразная деятельность
981,"Личностное развитие, как в работе, так и в общественной жизни предприятия и Росатома в целом"
982,Захват рынков сбыта
983,интересная работа в команде на благо России
984,Формирование единой молодежной команды
985,Повышение доли на международных рынках;
986,Экономический рост страны
987,Обеспечение безопасности страны
988,Снижение издержек
989,Оценка эффективности деятельности
990,Мой ежедневный труд и так наполнен смыслом.
991,Возможность карьерного роста по госкорпорации
992,"высокая зарплата, карьерный рост."
993,Обеспечение безопасности и экономического роста Российской Федерации
994,Продвижение новых продуктов и выход на международные рынки
995,Создание будущего
996,"Быть всегда на шаг впереди. Это значит, что мы должны стремится быть лидерами на глобальных рынках."
997,не готова ответить. Для начала больше поддержки молодёжи на местах от руководителей.
998,Обеспечение обороноспособности страны
999,",,Щит страны,,"
1000,зар. плата
1001,"Для меня ""большой целью"" Росатома является - повышение доли на международных рынках. Мне хотелось бы чтобы О НАС ЗНАЛИ! О НАС ГОВОРИЛИ! С НАМИ СЧИТАЛИСЬ!"
1002,Карьерный рост
1003,достижение глобального технологического лидерства
1004,делать мир лучше прекратить заниматься очковтирательством
1005,"Личное общение руководителей предприятий и молодежи,проявление интереса к их деятельности,а не формальное отношение."
1006,Снижение себестоимости продукции. Производство новых продуктов для внутренних и международных рынков.
1007,Интерес к работе
1008,Сила в единстве!
1009,Создание реального нового продукта. В свое время участие в создании Атомного проекта породило в людях единство и понимание реализации данной цели.
1010,Повысить благосостояние его работников
1011,"Освоение Арктики, обеспечение безопасности на СМП"
1012,Максимальное доминирование ядерного вооружения России на международной арене.
1013,понятия не имею
1014,"Уменьшение себестоимости выпускаемой продукции, увеличение присутствия продукции гос.корпорации ""Росатом"" на международных рынках"
1015,"Постоянное совершенствование технологий, что позволяет постоянно учиться и профессионально расти."
1016,Единая команда и общие цели.
1017,сохранение и преумножение величия российской отрасли атомной энергетики
1018,Внедрение новых совершенных технологий.
1019,Приносить пользу предприятию и стране. Не допустить отставания в профильном направлении.
1020,"В любой цели важен результат, причём видимый результат. Ведь когда у тебя что то получается, ставишь перед собой новые цели и ожидаешь нового результата. Важна даже не цель, а то что ты хочешь от неё получить."
1021,Амбициозные задачи для молодежи
1022,Перспектива карьерного роста
1023,Быть единой командой и работать на благо России и Росатома
1024,Беспрецендентное соблюдение сроков и обязательств
1025,Лидер среди Госкорпораций РФ
1026,Бесплатное электричество для жителей РФ
1027,Повышение благосостояния и социального статуса своих сотрудников
1028,Экологически чистая энергия в каждый дом
1029,Понимание направления развития Росатома в конкретных показателях на 5 лет
1030,Обеспечение безопасности РФ
1031,"Реализация новых, свежих идей, генерируемых молодежью, работающей в отрасли."
1032,повышение своих компетенций и обмен опыта с иностранными коллегами
1033,Обеспечение суверенитета РФ и увеличение скорости роста экономики
1034,соответствие затраченного труда оплате.
1035,Делаем одно большое дело!!!
1036,"В нынешнее время ""финансовая составляющая"" может мотивировать и заинтересовать ставить высокие цели и большие задачи, а затем их реализовывать."
1037,"Лидерство на мировом рынке, отражающееся непосредственно на доходах каждого из вовлеченных в конкретную деятельность сотрудников"
1038,Научные Мега проекты .
1039,Развитие науки и технологий в России
1040,"Новые направления развития, новая продукция"
1041,"Лидирующие позиции на рынке, развитие Отечественной науки, повышение конкурентоспособности страны"
1042,Никакая. Они все равно остаются только словами на бумаге.
1043,"Понимание необходимости результатов деятельности каждого сотрудника для: - обеспечения безопасности нашей страны; - реализации преимущества России по сравнению с другими странами в науке, технологиях, разработках и т.п.; - безусловного и постоянного развития науки, технологий, разработок и т.п."
1044,Затрудняюсь ответить.
1045,мир и процветание
1046,Продвижение на предприятиях отрасли корпоративных ценностей.
1047,"любая общечеловеческая, лишь бы виден был результат"
1048,увеличение доли продукции на международном рынке
1049,Мой ежедневный труд и так достаточно осмысленнен
1050,Защищенность молодых сотрудников в профессиональной среде
1051,Создание новых бизнесов
1052,Повышение уровня жизни работников
1053,Быть на шаг впереди
1054,Синхронизация всех молодежных объединений в единую молодежную сеть
1055,приносить пользу стране.
1056,стабильный доход
1057,"Создание ядерного щита, как основного вида защиты России"
1058,Передовые процессы
1059,Новые цифровые продукты для ОПК и гражданского сектора.
1060,.
1061,мир во всем мире и бесплатная энергия
1062,"Развитие наукомких отраслей, цифровизация"
1063,Интересы сотрудников.
1064,применение атомной энергии в мирных целях
1065,"я хочу гордиться своей страной в общем и своим предприятием в частности. считаю, что ВНИИЭФ не должен быть лишь ядерным считом, но должен разрабатывать и показывать миру мощное современное вооружение. чтобы нас не только уважали, но и боялись."
1066,"Направленность и чёткое понимание, куда движется отрасль"
1067,Росатом и Россия - главные в моей жизни
1068,обеспечение обороноспособности России
1069,не знаю
1070,Повышение роста Росатома
1071,Все цели вдохновляют
1072,мир во всём мире и бесплатная энергия
1073,Карьерные перспективы
1074,Запуск лазерной установки!
1075,мир в мире
1076,Повышение престижа
1077,Выход на гражданскую продукцию.
1078,развитие науки и техники
1079,Поддержка ядерного щита РОССИИ.
1080,Если все поставленные и выполняемые задачи будут приносить пользу предприятию.
1081,"Если все поставленные задачи будут приносить пользу предприятию, а не бессмысленную трату рабочего времени на разработку невыполняемых планов."
1082,"Научный прорыв, принципиально новый виток в развитии современных технологий, например, телепортация."
1083,Инновационная деятельность и творческая реализация
1084,"укрепление обороноспособности России и как следствие, более независимая политика государства"
1085,Если все будет прозрачно!!!и всякого рода проверки и аудиты не будут подстроены !!!
1086,Непосредственное участие в международных проектах.
1087,Устойчиво развиваться и при этом обеспечить мир новыми продуктами на основе инновационных технологий во благо всего человечества.
1088,"Внедрение современных технологий не единично, а повсеместно"
1089,Лидерство на мировом рынке
1090,Продвижение новых технологий
1091,Внедрение собственных мировых стандартов в области автоматизации и атомной энергетики
1092,Единая команда Росатома
1093,Обеспечение безопасности России
1094,Востребованность моего труда и адекватная его оценка
1095,Организовать работу руководства так что б оно отвечало отвечало перед нижестоящими коллегами.
1096,Честность и открытость и Единая команда
1097,Понимание того что ты делаешь очень важно в достижении целей всей корпорации. Что твоя работа очень важна и именно ты работая в единой команде выполнять эту работу. Очень важно видеть результат своей деятельности.
1098,"Трансформация в полностью ""Цифровой Росатом"""
1099,Росатом - лидер на мировом рынке
1100,Создание новых продуктов и продвижение их на мировые рынки
1101,Ядерный щит страны
1102,Внедрение новых продуктов
1103,Защита страны.
1104,Комфортная рабочая атмосфера
