,Какая «большая цель» Росатома может вдохновить Вас на работу и наполнить смыслом ваш ежедневный труд?
0,Процветание страны и её народов
1,Повышение материального благосостояния страны и моего в частности
2,"Фундаментальные открытия в области энергоресурсов, которые позволят перевернуть общественное сознание."
3,Профессиональное развитие
4,1. Создание новой технологической платформы/технологического уклада использования атомной энергии в XXI в
5,"Команда, которая готова работать сообща и коллективно решать сложные вопросы. Правильное разделение труда. Качество продукции должно быть выше исполнения сроков."
6,Качество и новые прогрессивные технологии.
7,"""НИКОГДА НЕ ОСТАНАВЛИВАЙСЯ НА ДОСТИГНУТОМ,ИДИ ВСЕГДА НА ШАГ ВПЕРЕДИ СВОИХ КОНКУРЕНТОВ"""
8,"Стабильная, хорошо оплачиваемая, понятная и приносящая ежедневно успешные результаты работа"
9,"Каждый человек должен чувствовать свою нужность, значимость в проекте ежедневно! От каждого из нас зависит и командная работа проекта, и результаты деятельности Росатома. Росатом ценит каждого Работника! Цель Росатома - сделать такой эффективный механизм стимулирования труда каждого работника, который сможет побудить каждого Работника ежедневно командой ""сворачивать горы""!"
10,"Она уже есть: ""Сильней Росатом - сильней Россия!"". Работаю в одной из самых высокотехнологичных компаний, являющейся локомотивом развития и суверенности страны. Хочется больше информации о вкладе Росатома в экономику, оборону, социалку, бюджеты в сравнении с другими компаниями России."
11,Сокращение себестоимости и времени протекания процессов
12,Лидерство на глобальных рынках
13,Новые продукты
14,Повышение благосостояния жителей России
15,Модернизация производства
16,"Ценность сотрудника, отдавшего большую часть жизни отрасли, после ухода на пенсию. Чувство спины на старости."
17,"Создание единой базы аккредитованных поставщиков товаров. Очень много на рынке поставщиков, кто предлагает не качественный товар, в следствии чего, нарушаются сроки сдачи продукции. А если бы комиссия выезжала, смотрела на возможности поставщика, его продукции, давала бы заключение о возможности закупки у данного поставщика, то было бы меньше брака."
18,Ввод в эксплуатацию в г. Певек ПАТЭС
19,"Становление мировым лидером в области строительства АЭС. Становление бренда ROSATOM на глобальной арене гарантией качества, безопасности, выполнения точно в срок (ответственности)."
20,Затрудняюсь ответить
21,"Меня вдохновляет ""большая цель"" Росатома такая как развитие центра ядерной медицины в Боливии. Хочу в Боливию"
22,"Росатом делает идеологию будущего, а правильную жизнь- сейчас"
23,Я и так вдохновлен!
24,"Осознавая то какой вклад вносит Росатом в обеспечение безопасности нашей страны, уже сейчас осознаю важность нашей работы."
25,"Росатом-это правильно. То, что я делаю-это правильно. Для моей совести( это честно и справедливо), для моей семьи( это надежный источник благосостоянияи в юности, и в старости), для моего города( это комфорт и и перспектива), для моей страны ( это процветание и защита ). В Росатома делают то, что правильно. То, чем гордятся сейчас наши дети и будут гордиться внуки. В Росатоме делают идеологию будущего, а достойную жизнь-сейчас."
26,"Работа в проекте ""Умный город"""
27,"Работая в Росатоме (дивизион ЯОК) уже сейчас понимаю, как важен наш общий труд на благо сохранения мира."
28,Мирная жизнь.
29,Уровень жизни работников ГК будет существенно выше. Зарплата будет достойной. В таких условиях возможно отдавать работе все.
30,Использование атомной энергии во благо каждого человека. Эта энергия сильна и надежна. Она дает комфорт и безопасность каждому жителю России.
31,Формирование единой команды
32,Завоевание новых рынков.
33,Выход на крупные рынки с продуктами информационных технологий
34,Быть лидером в эффективности!
35,Служить нашей родине.
36,"... Пусть с успехом трудиться всегда будет охота! Пусть в сознании вашем живет мысль одна, Что с вашим трудом сильна наша страна."
37,Снижение себестоимости
38,"Производственная система России в ее буквальной реализации, как это происходит сейчас"
39,Повышение и удержание доли присутствия на международных рынках
40,если эта цель принесет пользу людям
41,Глобализация атомных технологий с целью повышения уровня жизни и снижения себестоимости энергии
42,"При наличии термина Интересы госкорпорации превыше интересов дивизиона, интересы дивизиона превыше интересов предприятия. Вряд ли цель Росатома может вдохновить работника предприятия."
43,Чтобы каждый работающий в отрасли чувствовал стабильность и уверенность в завтрашнем дне своем и отрасли.
44,Переход на унифицированный проект АЭС
45,"Создание и активное применение во всем мире новых востребованных технологий для того, чтобы делать мир более эффективным и безопасным."
46,Цифровизация
47,"Государственные приоритеты. Влияние и интерес государства, поддерживающие возможности, проекты и программы развития государственного концерна. Непосредственное участие в этих проекта и программах и, конечно же, развитие и прирост социальных аспектов, в качестве достойного вознаграждения за труд."
48,"компания №1 в мире по ""Зеленой"" энергии + Корпорация ТАЛАНТОВ"
49,обеспечение надежности ядерного щита как основы национальной безопасности
50,Космическая программа
51,"Мой ежедневный труд наполнен смыслом с соответствии со стратегической целью ГК ""Росатом"" ""Снижение себестоимости продукции и сроков протекания процессов""."
52,"Исходя из моего опыта работы в других государственных корпорациях, Росатом отличается от них в лучшую сторону по компетенциям и личностному уровню работников, корпоративной культуре, стилю работы, сложностью решаемых задач. В любом обществе должны быть лидеры процессов изменений. Росатом (его работники) могли бы стать таковыми. Мешает ""закрытость"" отрасли, связанная с ее спецификой, акцентированной на безопасность. Возможным вариантом продвижения изменений может быть модель, используемая в мире крупными корпорациями (в РФ ее активно применяют Ростех, Роснано, а в Росатоме - это единичные случаи), а именно создание значительного количества SPV-компаний различных направлений с не контролирующим участием Росатома. То есть, цель, которая могла бы вдохновить: перенос компетенций, отраслевой культуры в различные технологичные направления промышленности для трансформации общества и экономики страны."
53,Нет ответа.
54,"Из существующих целей: - Повышение доли на международных рынках; - Новые продукты для российского и международных рынков. Предложение по новой ""Большой Цели"": - повышение доверия и конкурентной привлекательности российских экспортеров в лице предприятий ГК Росатом на международных рынках за счет высочайшего качества предлагаемых товаров и услуг, надежности, безупречного сервиса и активного участия в процессах устойчивого развития."
55,Рост благосостояния страны.
56,"Способствовать экономическому росту, социальной стабильности и содействовать процветанию и прогрессу."
57,Новые продукты для Российского и международного рынков
58,"Обеспечение глобального лидерства Росатома в области цифровизации и области ""чистой энергии"" в течении следующих 5 лет."
59,"Добится решения системных технологических прорывов по всем направления научно-производственной деятельности ГК. Приумножение оборонного, научного и производственного потенциала РФ."
60,"Продвижение на международном рынке, развитие новых продуктов"
61,Развитие научной деятельности на предприятиях энергетического дивизиона (АЭС)создание глобальных проектов между предприятиями
62,Большая зарплата
63,"Внедрение инновационных технологий, освоение новых направлений в газовой, нефтяной и других отраслях."
64,Лидерство и высокая конкурентоспособность на мировом рынке
65,Участие в разработке новых продуктов для российского и мирового рынка
66,"Вдохновение и смысл есть всегда, независимо от целей, а иначе зачем ходить на работу... ."
67,"Разработка новых продуктов, цифровизация отрасли."
68,"Освоение зарубежных рынков, повышение рейтинга Страны в рамках успешной реализации проектов за рубежом."
69,Достижение грузопотока по СМП до 100 млн тн в ближайшие годы.
70,"Обеспечение безопасности миру в эксплуатации атомной отрасли. Разработка технологий в медицине, помогающих излечить серьезные заболевания."
71,космические и летательные аппараты с ядерными реакторами
72,"Когда руководители на всех уровнях ответственности уйдут от девиза ""нам нужны не умные, а послушные"", при этом ""Ценности Росатома"" станут не декларацией и пропуском к повышению статуса, а внутренней потребностью большей части коллектива отрасли. Может это и не является целью, тем более ""большой"" для Росатома, но это уж точно наполняло бы смыслом ежедневный труд."
73,"Отсутствие в поставленных задачах бессмысленных, поставленных в ранг приоритетных, не относящихся к моей непосредственной работе задач, - разделение труда."
74,Большой цели по моему соответствуют стратегические цели Росатома.
75,"Цель должна быть с размером и масштабом, достойным цивилизации ""Русского Мира"", к которому мы все принадлежим. Например - обеспечить энергией и пресной водой весь континент и в перспективе весь Мир. Или обеспечить судоходство на огромных атомных транспортных ледокольных судах по севморпути и в перспективе по всему миру. Или поставить глобальную цель по космической тематике подобного масштаба. И при постановке цели оперировать не цифрами и тоннами - обычные граждане плохо понимают масштаб в цифрах - а ИДЕЯМИ. Люди из нашего Мира без подобных ИДЕЙ скучают и гаснут. Западная идея ""набить пузо и погреться на солнышке на Кипре"" быстро приедается..."
76,Увеличение доли международного рынка.
77,"«Большой целью» Росатома должно стать поднятие уровня жизни своих сотрудников, особенно узкоспециализированных научного и технического направлений."
78,Моя большая цель это наполнить смыслом мою работу в Росатоме!
79,Участие в международных проектах
80,"Атомная энергия на службе человечества. Престиж России, ""зеленые"" технологии, современная компания мирового уровня, прорывные идеи."
81,"Получение максимальной прибыли от реализации продуктов (услуг) Госкорпорации ""Росатом"" в текущем и последующих периодах"
82,Каждому по заслугам
83,экономический и социальный лидер в государстве(РФ)
84,"Стать поистине успешным примером цифровой компании в стране и в мире. С понятными и удобными цифровыми сервисами как по внутренним процессам, так и по процессам взаимодействия с внешними пользователями (Контрагенты, Заказчики)."
85,Новые продукты для российского и международных рынков.
86,Выход на международные рынки по новым продуктам
87,развитие ядерных медицинских направлений
88,Снижение себестоимости продукции и сроков протекания процессов.
89,"Кардинальное изменение мирового топливного баланса в пользу ядерных технологий (синтез, реакторы с воспроизводством топлива и утилизацией минорных актинидов)."
90,"Обеспечение безопасности во всем мире (включая ядерную, энергетическую, экологическую, промышленную, военный паритет и пр.)"
91,"Росатом должен не на словах, а на деле становиться организаций с передовыми технологиями проектирования и производства. Пока, в среднем по корпорации, отставание в технологиях 25-30 лет. Росатом не на словах, а на деле развивает и поддерживает действительно собственное производство новых продуктов. Сейчас корпорация скорее будет заимствовать заграничное, чем потрудиться в создании своей продукции."
92,Суверенитет России.
93,повышение эффективности деятельности Корпорации
94,Безопасность
95,"Новые инновационные/технологичные продукты. Продукты, которые смогу позволить Госкрпорации и России стать мировым лидером."
96,Мы делаем жизнь людей лучше и безопаснее.
97,"Основная цель: Ведущая отрасль в России, расширения рынка ввода мощностей, продукции. Обеспечивающие и способствующие цели: 1.Работа - главный смысл жизни. 2. Улучшение труда - необходимо сократить документооборот - по станции >140тыс/год документов 3. В России все должны стремиться на работу в ГК - повышение заработной платы и улучшение нужд в городах-спутниках."
98,"Изменить в корне структуру и политику управления: - исключить девизиональное управление, сформировав в ГК профильные департаменты (аналог ЯОК) - предоставить максимум полномочий генеральным директорам предприятий, включая кадровые решения по ЗГД, оплату труда, инвестиционные решения, социальную политику, закупку ТМЦ; - предоставить предприятиям возможность самостоятельного инвестиционного решения на модернизацию оборудования взамен изношенного с учетом суммы амортизационных отчислений"
99,"""Работаем сегодня, создавая будущее"". В условиях быстрых изменений хотелось бы увидеть как можно больше реализаций тех технологических новшеств, тех проектов, которые сейчас пока еще только в виде идей или начинаний. Это очень важно чувствовать, что своим трудом ты можешь приблизить создание новых технологий, увидеть результаты своего труда."
100,Снижение протекания процессов за счет налаживания горизонтального взаимодействия.
101,Развитие новых бизнесов
102,Создание базы для развития следующих поколений.
103,Занятие лидирующей позиции.
104,"Сильная Россия, с развитой экономикой и благополучным обществом (обладающим равными возможностями и социальными гарантиями, без большого разрыва между богатыми и бедными), которая может позволить себе вести независимую политику и выстраивает честные взаимоотношения с остальными странами, на взаимовыгодных условиях."
105,"Идеи (цели), которые непосредственно связаны со стратегическими целями Росатома, в реализации которых я вижу свое непосредственное участие (весь мой ежедневный труд направлен на выполнение задач, обеспечивающих достижение ""больших целей"")."
106,Стать импортонезависимой в плане используемого программного обеспечения
107,Выход на международные рынки
108,Развиваться вместе с Росатомом.
109,Experientia docet - Опыт учит
110,Расширение производства оборудования машзала в РФ по технологии Арабель турбиной и генератором
111,Снижение себестоимости продукции и сроков протекания процессов
112,"Меня может вдохновить продвижение ""большой цели» за пределами Нашей Родины и показать этим европейцам, что и у нас тоже есть высокая заработная плата и как благотворно цели Росатома влияют на каждого работника госкорпорации."
113,работать за производство чистой энергии и обеспечить свая страна этой чистой энергией.
