,Какая «большая цель» Росатома может вдохновить Вас на работу и наполнить смыслом ваш ежедневный труд?
465,Достойная оплата моего ежедневного труда.
466,повышение производительности труда
467,Эффективность проектов(не на бумаге) и отсутствие бумажной волокиты.
468,Укрепление и устойчивое развитие нашей страны - России.
469,"Обеспечение безопасности РФ и формирование условий для экономического роста Госкорпорации ""Росатом"" и РФ в целом."
470,Улучшить экологию планеты.
471,Улучшение благосостояния ВСЕХ работников Росатома.
472,Монополизация рынка атомной промышленности.
473,Снижение сроков протекания процессов и их цифровизация.
474,"Повышение доли Росатома на международных рынках, позволит создать больше рабочих мест, укрепит позиции страны, увеличит количество заключаемых контрактов и позволит увеличить з. плату сотрудникам"
475,Росатом самая успешная и динамично развивающаяся компания России. Являясь специалистом этой огромной команды хочется творить на благо России.
476,Нести изменения качества жизни
477,"Цель - Обеспечение наибольшего уровня оплаты труда среди аналогичных отраслей (нефтедобывающая/перерабатывающая, газодобывающая/перерабатывающая, гидроэнергетическая и т.д.), развитее, действительно работающих социальных проектов в особенности проектов связанных с поддержкой молодых семей. Данное направление важно не только в рамках компании, но и страны в целом. К сожалению или радости, но самый вдохновляющий сегодня стимул это деньги, деньги это путь к семье, недвижимости, детям. Если у специалиста все в порядке с семьей, обеспечением семьи продуктами, ресурсами и т.д. специалист будет полностью посвящать себя основной работе."
478,"Обеспечение обороноспособности и безопасности моей страны. вдохновение в работе присутствует ежедневно, мы одна команда!"
479,Сделать жизнь конкретного человека лучше
480,"Инвестирование в будущее на всех уровнях, начиная с участка."
481,Создание огромных круизных атомных дирижаблей.
482,Поиск и внедрение альтернативных источников энергии
483,"Единое мышление в трудовой сфере, знание направления пути Организации, возможность карьерного роста не только в Организации, но и во всей отрасли."
484,"Выход корпорации в лидеры атомной промышленности, за счет уникального предложения, не имеющего аналогов на рынке."
485,Больше станций по всему миру. Больше контрактов. В Латинской Америке всего 3 станции. В Африке вообще одна. Всякая помощь своим сотрудникам (например помощь в ипотеке).
486,"Разработка новейших технологий и высококачественного конкурентного оборудования (систем, комплексов)"
487,Строительство новых блоков и станций замещения
488,"Достижение максимальной эффективности в работе машиностроительного дивизиона. Снижение себестоимости продукции не за счет сокращения основного производственного персонала (рабочих, ИТР) и перевода вспомогательных служб на аутсортинг, а пересмотр численности топ-менеджмента, ликвидация дублирующих друг друга дирекций с размытыми, не конкретизированными зонами ответственности. Необходимо позволить производственным подразделениям заниматься своей непосредственной работой, а не совмещать работу отдела кадров, снабжения и др."
489,Постоянное внедрение новейших инновационных разработок в области инженерии и технологии.
490,обеспечение безопасности каждого человека
491,Заинтересованность Госкорпорации в моем предприятии и развитие его в будущем. Наращивание портфеля заказов.
492,"Быть лидирующей мировой корпорацией в области энергетики! При этом термин ""Лидирующая"" должен отражать не только уровень авторитета и компетенции, но и соответствующие этому уровню зарплаты всех работников, а не только ""топ""руководителей."
493,"Развитие неядерного бизнеса, закрепление позиции на рынке перспективной продукции, в частности продукции из полимерных композиционных материалов (ПКМ)."
494,"для меня лично это уверенность в будущем, то есть не непрерывные преобразования, сокращения, объединения, разъединения, переименования, что в общем то по моему лишь видимость работы и способы отмывания и осваивания денег, а конкретные видимые результатымоей деятельности и деятельности росатома конкретно в моем городе, а не где то там, в красивых отчетах. пока на месте, конкретно здесь, на уэхк и моем предприятии, сейчас оно Центротех, все плохо и становиться только хуже никакие красивые визуализации и презентации на днях информирования меня и других работников ни в чем не убедят."
495,Выход титановой продукции на международные рынки.
496,"Альтернативные источники энергии, например, использование энергии ""нулевой точки"", использование разработок Тесла."
497,Рост благосостояния сотрудников ГК и россиян в целом. Устранение нехватки медицинских специалистов в ЗАТО
498,строительство атомных станций за рубежом
499,Улучшение жизни людей в стране
500,Цель сохранить и передать будущим поколениям больше чем мы имеем сейчас.
501,"Завоевание мировых рынков с получением прибыли, которая частично будет направлена на улучшение благосостояния сотрудников, участвующих в процессах достижения цели."
502,Развитие экономики РФ.
503,"Социальная значимость, к примеру чтобы завод помогал городу, а Росатом стране в целом"
504,"На мой взгляд, наибольшей актуальностью (применительно к конструкторской форме своей производственной деятельности) должна являться стратегическая цель - ""Новые продукты для российского и международных рынков"", что позволит укрепить и повысить в целом финансово-экономический потенциал как ООО ""НПО ""Центротех"", так и каждого отдельно взятого работника нашего предприятия, включая сотрудников любой категорийности."
505,Быть мировым лидером в области атомной энергетики
506,"Стать лидером по атомной энергетике в мире (для меня это может осуществляться через освещение безопасности АЭ среди населения, привлечение и увлечение молодежи АЭС (и не только в атомных городах), развитие науки среди молодых на предприятиях). Именно меня может вдохновить участие в глобальном проекте, возможность обучения для развития своих компетенций, и получения дополнительных знаний в технической сфере"
507,"Достижение конкретной цели (не в денежном эквиваленте), которая позволяет нашей Родине подтвердить статус великой державы и государства заботящегося о своих гражданах."
508,"Польза для гражданского общества. Например, создание опреснительных комплексов большой мощности; реконструкция/создание предприятий пищевой промышленности (молоко, соль и т.п.); природоохранные мероприятия: предприятия, перерабатывающие накопленные и постоянно поступающие отходы - РТИ, нефтешламы, асбестовые отходы,бытовой мусор; производство удобрений; переработка медицинских отходов; производство особо чистых газов (ксенон, криптон, неон, гелий) и т.п.; переработка промышленных сточных вод."
509,Занять достойное место среди мировых корпораций.
510,"Компактный ядерный энергоисточник, непосредственно использующий энергию гамма-излучения (это нерешенная научно-техническая задача). По сути - превращение любых ""отходов-излучателей"" в энергоисточник и создание вместо ""могильников РАО"" ""РАО-электростанций"". Исследование физики полураспада, использование случайности распада отдельно взятого ядра как генератор случайных чисел, исследование распределения распада, интеграция физики полураспада в архитектуру вычислительных систем при создании искусственного интеллекта."
511,Замыкание ядерного топливного цикла. Повышение благосостояния работников.
512,"Обеспечение обороноспособности и безопасности РФ, а также повышение потенциала РФ на международном рынке"
513,Наука
514,Что продукция/услуги используются в решении значимых для страны/мира задач.
515,Защита Родины!
516,"освоение новых технологий, созидание, выпуск новой продукции, в том числе ТНП."
517,"Программа развития отрасли, влияющая на подъем экономики страны в целом и обеспечивающая: -защиту своих сотрудников (гарантия работы); -финансовую стабильность."
518,"Мне сложно ответить на этот вопрос. Я и так вдохновлен своей работой, т.к. я работаю на строящемся предприятии и я понимаю какую огромную роль мы вносим в развитие ""Росатома""."
519,"Повышение качества жизни в городе Северске, увеличение рабочих мест на градообразующем предприятии."
520,"Ввести здравый смысл в работу, удалив дармоедов, организации - прокладки, кучу ненужных регламентов и документов"
521,лидерство в атомной отрасли в мире
522,Вдохновить может любая масштабная задача направленная на укрепление позиций Росатома на мировом рынке. Однако главным условием будет являться ощущение причастности. Лично для меня неоценимый вес имеет ощущение моего личного вклада в общее дело.
523,"Новые производства (любых товаров/услуг) - во всех городах присутствия РОСАТОМ. Чем больше будет людей работать в производстве товаров-услуг, тем больше будет гордости и вдохновения к работе."
524,"повышение благосостояния жителей РФ, работа по выводу страны на уровень мировых лидеров в части здравоохранения, технологий, социального обеспечения, культуры и образования, качества жизни. развитие инновационной продукции, внедрение новых технологий, научно-исследовательская работа"
525,Повышение престижа России как мировой державы. Обеспечение каждого Россиянина инновационными продуктами и доступам к доступной электроэнергии. Поддержание обороноспособности страны.
526,Большая цель - Большая Зарплата
527,Разработка новых продуктов
528,Независимость РФ
529,Надежность и безопасность работы АЭС и ТЭЦ
530,Ставить перед собой все новые и новые задачи и выполнять стратегические цели Росатома.
531,"Развития предприятия, вклад каждого в общее дело."
532,"Принять к сведению содержание статьи ""Что будет, когда китайцы достроят «искусственное солнце»? Новая эра или тотальное обнищание России?"" Ссылка на источник далее. https://zen.yandex.ru/media/istoricheskie_fakty/chto-budet-kogda-kitaicy-dostroiat-iskusstvennoe-solnce-novaia-era-ili-totalnoe-obniscanie-rossii-5c861198a7af8400b34ce254"
533,"Создание продуктов высокого качества, которые будут иметь абсолютные преимущества перед конкурентами, тем самым вызывая интерес большого количества заказчиков и интенсивно увеличивая портфель заказов Госкорпорации. Если в двух словах - создание привлекательного с точки зрения инвесторов продукта высочайшего качества."
534,"Работа на результат, в атмосфере справедливости."
535,Развитие и поддержка ОЦК!!!
536,возможность сделать жизнь людей лучше
537,Технологический рывок; работа на благо государства и граждан
538,Мой ежедневный труд наполнен смыслом.
539,"В моей работе очень полезным было бы взаимодействие с другим дивизионом. На данный момент инструмента связи нет. Мы с коллегой работаем уже полтора года над совместным проектом, в рамках одного из проектов корпакадемии, движимые лишь энтузиазмом и личной преданностью профессии. Нас не интересует финансовая мотивация, мы лишь хотим двигать свою профессию вперед. Для меня ""большой целью"" может стать некая структура, которая будет включать в себя активистов, вроде нас, обеспечивая нам возможность работать совместно, как носителей опыта. Междивизиональные распри не дают раскрыть потенциал проекта полностью."
540,"на работу меня может вдохновить материальное стимулирование (денежное вознаграждение, повышение реальной заработной платы)."
541,Международное сотрудничество
542,Безопасность сотрудников атомной отрасли.
543,Развитие передовых технологий и передача опыта партнерами социальной сфере
544,"Новые, конкурентные энергоблоки в России и за рубежом."
545,Программа ввода новых АЭС в РФ
546,Защита Родины
547,Развитие технологий и создание продуктов направленных на улучшение жизни людей.
548,Перспектива внедрения и развития моих результатов работы
549,Трансформация Росатома в глобальную международную корпорацию
550,"снижение себестоимости продукта за счет внедрения новых технологий. (новое программное обеспечение на всех этапах производства, современное безопасное оборудование, модернизация или замена устаревшего оборудования со сроком более 10 лет- независимо от его состояния, сокращение всех согласующих сторон при закупках, документооборота)"
551,Тотальная модернизация отрасли.
552,Восстановление и развитие отрасли станкостроение.
553,Обеспечивать доступной и стабильной электроэнергией Россию и зарубежные страны. Обеспечивать достойную зарплату сотрудникам атомной отрасли за счёт повышения эффективности работы.
554,"Работать так, чтобы окружающий мир стал безопаснее и чище."
555,Большие деньги
556,Заработать больше денег.
557,Служить интересам нашей родины.
558,Улучшение качества жизни людей
559,Вклад в укрепление экономики и безопасности РФ
560,"Обеспечение безопасности и стабильности жизни граждан России, уверенность в завтрашнем дне"
561,"Мероприятие для сотрудников корпорации в форме конкурса, позволяющее показать в полной мере способности и умения работника в профессиональном и в творческом плане,своего рода набор заданий, выполнение которых позволит получить материальное вознаграждение или ценный подарок, либо путешествие."
562,"Безопасность и целостность государства. А вообще, главное что-бы у детей было все хорошо, для этого и тружусь."
563,"Никакая. Для меня важнее содержание моей работы, отношение ко мне, а не лозунги. Но учитывая арктическое направление, меня бы вдохновило, если бы новой ценностью Росатома стало что-нибудь экологическое. Судьба белых медведей в Арктике, по идее, теперь должна Росатом интересовать не меньше тоннажа перевозимого Северным морским путем грузов. Еще меня интересует тема мусора, которого мы, несмотря на всю чистоту нашей энергии, производим массу. Как мы его утилизируем, как мы можем внедрить эти технологии в отечественный мусорный бизнес, как, опять таки, мы можем помочь решить проблему арктического мусора?.."
564,Материальное стимулирование специалистов узкого профиля на море будет лучшим вдохновением для ежедневной плодотворной работы.
565,"Сейчас большая и первоочерёдная цель Росатома - это внедрение новых технологий и развитие цифровой трансформации. Считаю, что работа в данной сфере даст серьёзные плоды. С Цифровой трансформацией мы сможем вывести не только Росатом на новый уровень бизнеса, но и поставить Россию на первую ступень пьедестала цифровых технологий мира!"
566,Интересная работа над новым проектом.
567,Сделать счастливым каждого рядового работника предприятий атомной отрасли
568,Всего и так хватает.
569,"Сделать мир для людей вокруг лучше (чище, безопаснее, справедливее)."
570,Укрепление и расширение влияния на международном рынке.
571,Участие в создании ледокола Лидер.
