,Какая «большая цель» Росатома может вдохновить Вас на работу и наполнить смыслом ваш ежедневный труд?
1375,"Не очень понятный вопрос. Необходимо выбрать из существующих задекларированных целей Росатома? Считаю, что одним из внутренних резервов развития отрасли это - Утилизация энергетического и творческого потенциала молодежи с практическими целями путем развития внутреннего предпринимательства. Лидеры, которые имеют внутренние силы и энергию что-то самостоятельно организовать, делают это обычно, по статистике, в период от 20 до 35 лет. Т.е. это молодежь в терминологии этого опроса. Такие люди, попадая в забюрократизированные структуры предприятий отрасли или сразу уходят наружу, чтобы там самостоятельно реализовывать свой потенциал. Или даже не хотят идти внутрь. Те кто немного послабее духом, но тоже могли бы присоединиться к лидерам изменений и сформировать команды, начинают подстраиваться под существующие на предприятиях отрасли порядки. И постепенно теряют свое рвение что-то менять. Поэтому потенциал молодежи слабо используется. Внутреннее предпринимательство. Это когда создана такая система. Когда под какие-либо проекты. Большие или маленькие. Создаются отдельные юрлица (общества), которые реализуют эти проекты. Финансирование под проекты может быть из специально созданных внутреотраслевых фондов. Лидеры таких команд должны разделять риски, т.е. участвовать в капитале этих обществ. Может через механизмы личных займов из тех же внетреотраслевых фондов. Но лидеры и участники этих команд должны понимать, за что они отдают свои силы и энергию. Эти люди должны иметь доли в этих малых предприятиях. Если бы что-то подобное работало, то: 1. Качество молодежи, которая работает внутри отрасли, существенно выросло бы. Соответственно, это увеличило бы в целом кадровый потенциал отрасли. 2. Такая система была своеобразной ""внутренней школой"" управленцев."
1376,"Помощь детям специалистов отрасли (учеба, здоровье, спорт и др.). Нет смысла к чему-то стремиться, если после тебя ничего не останется."
1377,Строительство новых блоков и зарубежных АЭС
1378,безопасность и сооружение АЭС
1379,"Обеспечение национальной безопасности (ядерное сдерживание), ядерной и радиационной безопасности, а также развитие прикладной и фундаментальной науки."
1380,"Адекватное отношение ЗП/ответсвенность, отсутсвие навязанной рутины (ПСР, Отчетности ради отчетности, наказание за проступки, не опечатки правильности заполнения бланков)"
1381,Продвижение ценностей РОСАТОМА
1382,"для работы мне не требуются ""большие цели"" Росатома."
1383,устойчивые города
1384,участие в Отраслевом совете молодежи
1385,4
1386,Строительство наших энергоблоком по всему миру. Стать монополистом в этой сфере деятельности.
1387,"Быть лидером на мировом рынке, обладать ценными знаниями, которые помогут реализовать скрытый потенциал."
1388,Развитие бизнес проектов.
1389,Полет на Марс и аналогичные проекты связанные с поддержкой Роскосмоса
1390,Максимальное увеличение благосостояния своих сотрудников
1391,"Внести в коллективный договор обязательное требование: ежегодно при увеличении производительности труда работников на 7%, увеличить на данный процент оклад по грейдам всех работников, при достижении данного процента производительности по итогу года в году, следующему за отчетным. И не забывать ежегодное увеличения оклада по инфляции в сентябре, сделав его единым для всех работников: если 6% составляет инфляция, то всем грейдам проводить на этот процент увеличение. А не так, что кому на 1,2%, а соседу на 6,2% и средняя 6%."
1392,Снижение себестоимости продукции и времени протекания процессов
1393,развитие инфраструктуры городов-спутников для привлечения детей к занятию спортом
1394,"Основная мотивация в любой работе- это деньги.На работу мы все ходим зарабатывать деньги. Ни какие ""Мероприятия для семей сотрудников"" не будут наполнять смыслом ежедневный труд, если нет карьерного роста."
1395,САЭС-2
1396,Зависит от подразделения где я работаю
1397,увеличение влияния на улучшение экологии
1398,Вложение своего вклада в международном опыте по строительству станций
1399,Снижение коррупции в атомной отрасли
1400,"грамоты, премии"
1401,Повысить уровень жизни в атомных городах. Обеспечить стабильное будущие атомных городов
1402,Реализация зарубежных проектов.
1403,На шаг впереди. Стремление быть лидером.
1404,"""Большая Цель"" Росатома может быть любой, меня могут вдохновить и наполнить смыслом работу личные блага получаемые на этой работе. Красивые лозунги ""больших целей"" могут быть любым, все это интересно только сторонним людям."
1405,Трудно сказать
1406,"Обеспечить Россию чистой, безопасной, доступной энергией, позволяющей эффективно развиваться нашей родине. Хватит продавать ресурсы соседям! мы не безрукие! Наладим Российскую промышленность."
1407,"Поддержка молодых семей (например, жилищные программы) Возможность получать дополнительное образование"
1408,"Затрудняюсь выделить конкретную цель, вдохновение появляется от совокупности всех целей."
1409,Лидерство на мировом рынке атомной энергии - увеличение доли на международных рынках.
1410,"Ценность в молодых специалистах. Привлекать заинтересованных кадров к всевозможным командным играм, тренингам, мастер-классам, но только в нерабочее время!"
1411,Разрабока новой Паропроизводящей установки
1412,Корпоративная культура
1413,"Развитие атомной отрасли в России, для благополучия и процветания населения страны"
1414,Принципы Росатома-Принципы России
1415,Стратегические цели Росатома.
1416,Создание единой команды.
1417,Перспектива развития и соответствующее достойное вознаграждение за выполненную работу
1418,Развитие кадрового состава.
1419,"Стремление занять ведущую роль в энергетике как на внутреннем, так и на внешнем рынке."
1420,Реализация инноваций в перспективных отраслевых проектах в России и за рубежом. Цифровизация и модернизация процессов в атомной отрасли
1421,"Такой ""большой цели"" не существует"
1422,я не знаю
1423,"Вдохновляют существующие цели. И любые проекты, которые идут во благо обществу."
1424,"ядерная медицина, ведутся работы по созданию первого федерального центра ядерной медицины."
1425,"Что я работаю на уникальном предприятии, которое чтит традиции и заботится о населении, делает все возможное для повышения производительности труда, путем уменьшения бюрократии, а не наоборот."
1426,"Мне не нужна большая цель, я достаточно мотивирован. Моя работа интересная, я иду на неё с удовольствием."
1427,"Реальная оптимизация ""бумажных"" процессов; снижение объёма отчётности, которую никто не читает. Создание удобных и реально работающих отраслевых платформ по сбору и обработке данных."
1428,На шаг впереди!
1429,Исполнение ключевого события
1430,Строительство АЭС в Российской Федерации с целью достижения закрытого топливного цикла с учетом опережающих сроков строительства по сравнению с зарубежными проектами
1431,у меня есть все для выполнения своей работы.
1432,Выход на международные рынки и развитие новых технологий
1433,"Чтобы атомная отрасль России стала самой сильной, мощной и передовой в мире. Это абсолютно серьёзно!"
1434,Движение вперед
1435,"Улучшение качества профессионального развития и обучения, а так же уважительное отношение к труду и дружелюбная атмосфера"
1436,Повышение долии на международном рынке
1437,"Осмысленная работа, которая привнесет вклад в развитие предприятия."
1438,Социальное развитие городов спутников. Улучшение жизни населения городов спутников.
1439,Услышать рабочих.
1440,"Меня вдохновляет созидательная работа в команде с любой ПРОИЗВОДСТВЕННОЙ целью. И в прошлом вопросе нет места для ввода комментария, пишу здесь: Наиболее эффективными форматами мероприятий по работе с молодежью был бы так же молодежный электронный форум, WhatsApp. Спасибо и удачи в развитии Совета молодежи!"
1441,Достижение ГК Росатом стратегических целей
1442,Изменение мира к лучшему
1443,"Меньше рутиной работы, и больше творческой."
1444,"Мне непонятен вопрос. О каких ""больших целях"" идет речь? Возможно, указав в опросе эти ""большие цели"", было бы проще ответить на этот вопрос. Для выполнения своих обязанностей у меня достаточно мотивации."
1445,Участие во внешних мероприятиях всероссийского и международного уровня
1446,Развитие Росатома
1447,не могу ответить на этот вопрос
1448,Укрепление и развитие статуса ГК на международном рынке
1449,"Уважение в ЕДИНОЙ комаде, быть на шаг впереди"
1450,Лидирующее место в мире по сооружению и безопасной эксплуатации АЭС
1451,Прислушивание Росатома к поступаемым инициативам от молодого поколения коллектива Росатома.
1452,привлечение морда молодых специалистов в нашу отрасль и улучшение условий а также развитие уже действующих специалистов
1453,Открытость. Доверие. Но это не к Росатому. Это к линейным руководителям
1454,"Уверенность в завтрашнем дне, которая, к сожалению, у большинства в наше время отсутствует..."
1455,Работа в единой команде с реализацией инициатив для достижения отраслевых результатов.
1456,Повышение уровня жизни
1457,Димилитаризация всего мира.
1458,Мотивация денежного и спортивного стимулирования работников.
1459,"1.Действительная забота о росте благосостояния сотрудников, зарплатная политика и социальная поддержка без перекосов (когда в одном филиале/ЦА разрешено то, что отсутствует в другом филиале) 2.Приоритет на выполнение непосредственных производственных задач,а развитие вспомогательных направлений, направленных якобы на улучшение производственного процесса - во вторую и третью очередь, без ущерба и вреда для основной деятельности."
1460,Развитие Росатома до уровня флагмана российской промышленности и инновационной сферы деятельности (с минимизацией потока бессмысленного бумагооборота)
1461,"Вдохновить на работу и наполнить смыслом наш ежедневный труд сможет непосредственный руководитель, который по достоинству оценит работу подчинённого персонала и будет держать свои данные обещания."
1462,"Все на работу ходят для получения средств для существования в этом мире. Для меня значимым будет получение денежного вознаграждения за мою работу - повышение ИСН, разовые премии, повышение должности и т.д. Именно эта возможность как правило вдохновляет большинство людей."
1463,Цель уже есть. Быть первыми и лучшими.
1464,"Банальность, но это материальные поощрения. Все таки свои мечты мы можем осуществить только по средствам денег."
1465,нацеленность на результат
1466,Улучшения качества жизни работников
1467,Визиты на различные предприятия
1468,Цифровизация отрасли.
1469,"Оказание положительного влияния на развитие государства за счет развития городов расположения объектов атомной отрасли: развития инфраструктуры, социальных объектов, трудоустройства населения, увеличение бюджета городов. Увеличение роли Росатома на международной ""арене"" - увлечение доли заказов на ""продукты"" Росатома (строительство АЭС и т.д) за рубежом."
1470,"Развитие городов, в которых находятся атомные станции, а не городов, к которым они документально относятся."
1471,Снижение сроков протекания процессов с учетом обеспечения безопасной эксплуатации АЭС.
1472,Создание коммунизма!!!
1473,Благополучие сотрудников предприятия и жителелей города
1474,Переквалификация или перевод работника на другую должность в случае оптимизации численности персонала
1475,строительство Кольской АЭС-2
1476,"строительство Смоленской АЭС - 2, которое даст будущее родному городу. В данный момент уровень жизни в Десногорске снижается лавинообразным образом."
1477,"Затрудняюсь ответить, мой труд и так наполнен смыслом :)"
1478,Строительство САЭС-2.
1479,"Увеличения доли строительства в международном рынке и дальнейшее участие мне, как специалисту, на строительстве АЭС за границей"
1480,перекрёстный обмен знаниями
1481,"Для меня, большая цель Росатома заключается в принципиальном улучшении качества жизни людей. Электроэнергия занимает важную нишу в жизни каждого человека, и современное общество сложно представить без этого ценного ресурса. Повышение энергоэффективности, внедрение новейших технологий, расширение рынка продукции, эффективное выстраивание рабочего процесса, повышение качества сервиса - это задачи, над которыми каждый день работают сотрудники Росатома. И каждая эта задача в той или иной мере упрощает жизнь людей и делает её более комфортной. Каждый сотрудник в своей мере вносит вклад в эти задачи, и все вместе мы выполняем одну большую и важную миссию."
1482,"Достижение мирового уровня медицинских изысканий, особенно в бионике и аугметике, хотя Росатом этим не занимается, но в рамках текущего сотрудничества по радиомедицине можно было бы расширить компетенции. А так, в принципе, любая, после достижения которой я бы мог чувствовать себя частью сильной команды. И был бы престиж профессии. А не каждый раз слышать от знакомых вопрос, зачем(тут я сильно смягчил) я работаю во ВНИИ."
1483,Утроение МРОТ
1484,"Постоянное саморазвитие, во благо развитие отрасли"
1485,"Новые продукты, направленные на улучшение жизни в стране"
1486,Управляемый термоядерный синтез.
1487,Увеличение доли на международном рынке: работа на зарубежных объектах отрасли.
1488,Открытость руководства.
1489,"Я работаю за деньги, а не за идею. Вы же в курсе, что в предыдущем вопросе нет поля для комментария, а вариант ответа ""укажите в комментарии"" есть?"
1490,?
1491,"Видимость того, что Ты можешь повлиять на что-то."
1492,Уже наполнен
1493,"Новое направление деятельности Росатома, в котором моё участие будет непосредственным."
1494,"Совершентвование и развитие ГК ""Росатом"
1495,Движение вверх!
1496,новые продукты на российских и международных рынках
1497,Учитывание моих интересов
1498,Материальная мотивация и участие в новых и интересных проектах
1499,Уверенность в завтрашнем дне и карьерный рост
1500,нет информации
1501,Реализация проектов
1502,"Сохранение суверенитета РФ. Технологический ключ к здоровью, экологическому энергообеспечению будущих поколений."
1503,"Стабильный высокий зароботок, поощрение, поддержка в различных жизненных ситуациях, организация проведения совместного досуга для работников."
1504,Снижение себестоимости продуктов и сроков протекания процессов.
1505,123
1506,Когда росатом сможет быть на уровне воплощения идей уровня Илона Маска
1507,безопасность. Экономическая эффективность.
1508,"""Денег нет, но вы держитесь"""
1509,Получение международного опыта проектирования и обмен профессиональными навыками с высококлассными специалистами отрасли
1510,трудно ответить
1511,"Прозрачность работы, а не закулисные сплетни"
